<?xml version="1.0" encoding="UTF-8" ?>
<!--引入DTD-->
<!DOCTYPE basket SYSTEM "shopping.dtd">
<basket>
    <meat Origin="湖南宁乡" id="1" varieties="猪肉">
        <part>腿</part>
        <quality>上等</quality>
        <price>150.00</price>
    </meat>
    <meat Origin="内蒙古科尔沁草原" id="2" varieties="牛肉">
        <part>腿</part>
        <quality>上等</quality>
        <price>500.00</price>
    </meat>
</basket>